{
  "schemaVersion": "1.0.0",
  "plannerVersion": "1.0.0",
  "planId": "ownership.synthetic.program-lineage.orders.v1",
  "generatedAt": "2026-08-16T21:00:00Z",
  "evidenceMode": "synthetic",
  "sourceProvider": "aws",
  "target": {
    "environment": "prod",
    "environmentReference": "environment.production.orders",
    "region": "centralus",
    "targetReference": "target.postgresql.orders.flexible"
  },
  "status": "ready-for-human-review",
  "requiredChecks": [
    "control.ownership.artifacts-bound",
    "control.ownership.raci-complete",
    "control.ownership.authority-unambiguous",
    "control.ownership.separation-of-duties",
    "control.ownership.escalation-acyclic",
    "control.ownership.source-of-truth-authorized",
    "control.ownership.rollback-failback-owned",
    "control.ownership.evidence-current",
    "control.ownership.handoff-integrity",
    "control.ownership.replay-protected",
    "control.ownership.transition-order-valid",
    "control.ownership.lineage-monotonic",
    "control.ownership.safety-enforced"
  ],
  "checks": [
    {
      "id": "control.ownership.artifacts-bound",
      "classification": "pass",
      "summary": "Exact predecessor lineage, artifact, environment, target, and integrity digests must match protected bindings.",
      "evidenceReferences": [
        "sha256:0d5b8e4f5db3c96cfdb1c6c768b5c2be24ce4adae278cff8bff6be2864925b6a",
        "sha256:2c766019e5c4d17d547d0b5cb08f99eaed76a36d275af39f868f54639da9fec4",
        "sha256:4d853262c3b5a8be2d73249e5572bb83134d550e9e620a24e910b3da36d70ecc",
        "sha256:521abf57232d5793c86c2238af59d835c8a60c8aa95a0deb3338478243bd2c6a",
        "sha256:61d4ad3240bc004a56bd26152b8cf73cb789247a2ffccce1c21af66e8e3359a6",
        "sha256:66c10f23b2b23d1efffe0c5d1566f276f9f86b5e2ead2d3ddcc406200e5a34ef",
        "sha256:734ac28c9609ab59b8843c862da3bca9f16099698f5e4c29778e6e6d50cce964",
        "sha256:8e3634e2684e8de5de7909ff7e6536de1aec3e0cd0568fe0782530b501fecf66",
        "sha256:c73ef25d3ebd4cea602fcc35c6f263d9641ca489744f863d3326b80d6a7d185f"
      ]
    },
    {
      "id": "control.ownership.raci-complete",
      "classification": "pass",
      "summary": "Every canonical capability and state requires one accountable role plus explicit responsible, consulted, and informed sets.",
      "evidenceReferences": []
    },
    {
      "id": "control.ownership.authority-unambiguous",
      "classification": "pass",
      "summary": "DNS, certificate, CI/CD, deployment, database, application, recovery, and source-of-truth authorities must resolve to one qualified role and scope.",
      "evidenceReferences": []
    },
    {
      "id": "control.ownership.separation-of-duties",
      "classification": "pass",
      "summary": "Sensitive control-plane authorities require an approval role separate from accountable and responsible roles.",
      "evidenceReferences": []
    },
    {
      "id": "control.ownership.escalation-acyclic",
      "classification": "pass",
      "summary": "Escalation routes must be acyclic and cannot self-escalate.",
      "evidenceReferences": []
    },
    {
      "id": "control.ownership.source-of-truth-authorized",
      "classification": "pass",
      "summary": "A source-of-truth authority change requires explicit transfer approval and accepted handoff evidence.",
      "evidenceReferences": []
    },
    {
      "id": "control.ownership.rollback-failback-owned",
      "classification": "pass",
      "summary": "Rollback and failback must retain accountable, responsible, and approval authorities in every state.",
      "evidenceReferences": []
    },
    {
      "id": "control.ownership.evidence-current",
      "classification": "pass",
      "summary": "Handoff evidence must be observed, current, unexpired, and within the configured age at planning time.",
      "evidenceReferences": []
    },
    {
      "id": "control.ownership.handoff-integrity",
      "classification": "pass",
      "summary": "Every ownership change requires one accepted, digest-bound handoff from the prior authority to the successor.",
      "evidenceReferences": []
    },
    {
      "id": "control.ownership.replay-protected",
      "classification": "pass",
      "summary": "Attempt and handoff nonces and evidence digests must be unique and not replay accepted history.",
      "evidenceReferences": []
    },
    {
      "id": "control.ownership.transition-order-valid",
      "classification": "pass",
      "summary": "Ownership transitions must be complete, unique, and in canonical coexistence through failback order.",
      "evidenceReferences": []
    },
    {
      "id": "control.ownership.lineage-monotonic",
      "classification": "pass",
      "summary": "Accepted ownership attempts must form a monotonic, gap-free lineage.",
      "evidenceReferences": []
    },
    {
      "id": "control.ownership.safety-enforced",
      "classification": "pass",
      "summary": "The assessment must keep all execution flags false and all live operations disabled.",
      "evidenceReferences": []
    }
  ],
  "authorityMatrix": [
    {
      "state": "coexistence",
      "ordinal": 1,
      "assignments": [
        {
          "capabilityId": "dns-zones-records-resolvers",
          "accountable": "role.network",
          "responsible": [
            "role.network"
          ],
          "consulted": [
            "role.security"
          ],
          "informed": [
            "role.incident"
          ],
          "approvalAuthority": null,
          "authorityScope": "source-cloud"
        },
        {
          "capabilityId": "certificate-issuance-renewal",
          "accountable": "role.security",
          "responsible": [
            "role.security"
          ],
          "consulted": [
            "role.shared-platform"
          ],
          "informed": [
            "role.incident"
          ],
          "approvalAuthority": "role.incident",
          "authorityScope": "source-cloud"
        },
        {
          "capabilityId": "secret-stores-references-rotation",
          "accountable": "role.security",
          "responsible": [
            "role.security"
          ],
          "consulted": [
            "role.shared-platform"
          ],
          "informed": [
            "role.incident"
          ],
          "approvalAuthority": "role.incident",
          "authorityScope": "source-cloud"
        },
        {
          "capabilityId": "cicd-pipelines-runners",
          "accountable": "role.shared-platform",
          "responsible": [
            "role.shared-platform"
          ],
          "consulted": [
            "role.security"
          ],
          "informed": [
            "role.incident"
          ],
          "approvalAuthority": null,
          "authorityScope": "shared"
        },
        {
          "capabilityId": "artifact-promotion",
          "accountable": "role.shared-platform",
          "responsible": [
            "role.shared-platform"
          ],
          "consulted": [
            "role.security"
          ],
          "informed": [
            "role.incident"
          ],
          "approvalAuthority": "role.security",
          "authorityScope": "source-cloud"
        },
        {
          "capabilityId": "observability-telemetry-alert-routing",
          "accountable": "role.shared-platform",
          "responsible": [
            "role.shared-platform"
          ],
          "consulted": [
            "role.security"
          ],
          "informed": [
            "role.incident"
          ],
          "approvalAuthority": null,
          "authorityScope": "shared"
        },
        {
          "capabilityId": "incidents-oncall-escalation",
          "accountable": "role.incident",
          "responsible": [
            "role.incident"
          ],
          "consulted": [
            "role.security"
          ],
          "informed": [
            "role.application"
          ],
          "approvalAuthority": null,
          "authorityScope": "shared"
        },
        {
          "capabilityId": "feature-flags-configuration",
          "accountable": "role.application",
          "responsible": [
            "role.application"
          ],
          "consulted": [
            "role.security"
          ],
          "informed": [
            "role.incident"
          ],
          "approvalAuthority": null,
          "authorityScope": "shared"
        },
        {
          "capabilityId": "deployment-authority",
          "accountable": "role.shared-platform",
          "responsible": [
            "role.shared-platform"
          ],
          "consulted": [
            "role.security"
          ],
          "informed": [
            "role.incident"
          ],
          "approvalAuthority": "role.security",
          "authorityScope": "source-cloud"
        },
        {
          "capabilityId": "database-writes",
          "accountable": "role.database",
          "responsible": [
            "role.database"
          ],
          "consulted": [
            "role.security"
          ],
          "informed": [
            "role.incident"
          ],
          "approvalAuthority": "role.security",
          "authorityScope": "source-cloud"
        },
        {
          "capabilityId": "application-writes",
          "accountable": "role.application",
          "responsible": [
            "role.application"
          ],
          "consulted": [
            "role.security"
          ],
          "informed": [
            "role.incident"
          ],
          "approvalAuthority": "role.security",
          "authorityScope": "source-cloud"
        },
        {
          "capabilityId": "source-of-truth-transfer",
          "accountable": "role.database",
          "responsible": [
            "role.database"
          ],
          "consulted": [
            "role.security"
          ],
          "informed": [
            "role.incident"
          ],